story|action|classified_action|similarity
As a PI, I want to properly record all metadata, so that I can ensure proper running of the project in case of staff changes|properly record|update|0.21434150636196136
As a researcher, I want to indicate where my data will be stored during the project and where after the project, so that it remains accessible during all stages of the data lifecycle|indicate|update|0.2713603973388672
As a researcher, I want to import metadata that I captured with a metadata tool, so that I do not have to capture it again in a DMP|import|read|0.2535770535469055
As a data manager, I want to know how the data is used, so that I can develop more detailed usage and support scenarios with researchers|know|read|0.306169331073761
As a repository owner, I want to be able to check the planned provenance of the data that will be submitted at the end of a project, so that I can calculate necessary submission fees and check whether it belongs to our target group|check|read|0.2346770018339157
As an IT manager, I want to know about IT resource requirements early in the project lifecycle, so that I can enable resource acquisition planning|know|update|0.3389122486114502
As a PI, I want to plan what kind of data I want to record/store, so that I can ensure it will possible to store it|plan|update|0.19855332374572754
As an IT staff member, I want to know the security requirements of the data, so that I know which kind of security measures to apply|know|update|0.3103662133216858
As a data manager, I want to have the description of collected data sets that are used or updated throughout the project lifecycle, so that I can ensure the descriptions are current and add detail as the study proceeds|have|read|0.3621586859226227
As a researcher, I want to know which topics are mandatory and similar in all DMPs, so that I can save time through quickly writing it|know|update|0.39041683077812195
As a data manager, I want to know what the content of the data is, so that I can decide to which collection or repository the data fits|know|read|0.3679320812225342
As a PI, I want to record information about my DMP, so that an Ethics Committee can review this for compliance with ethical standards|record|read|0.2621736228466034
As a legalofficer, I want to know about data sensitivity, so that I can establish sharing options|know|read|0.27301502227783203
As a data librarian, I want to extract pointers from the DMP to metadata held in other systems, so that I can import this metadata into a data catalogue|extract|read|0.33997008204460144
As an IT staff member, I want to have an estimate of the produced data volume, so that I can plan the overall storage consumption|have|read|0.3484708070755005
As an administrator, I want to know who funded the project and their requirements, so that I can track the funder specific obligations|know|update|0.2698761522769928
As an archivemanager, I want to know the legal status of data, so that I can apply the legal requirements accordingly|know|read|0.13032910227775574
As a data manager, I want to know which kind of data types will be produced or collected, so that I can determine what basic support services and functionalities are required|know|read|0.3767794668674469
As an IT staff member, I want to know which kind of data types will be produced or collected, so that I can determine what basic support services and functionalities are required|know|read|0.355198472738266
As an archivemanager, I want to know in advance the conservation period of data, so that I can better organize the service by adapting the preservation actions|know in advance|read|0.24122914671897888
As a data manager, I want to document all rights necessary for managing the data, so that I can curate and preserve the data|document|update|0.2984124422073364
As a data manager, I want to know what the content of the data is, so that I can check whether the necessary expertise for maintaining intellectual reusability is available|know|read|0.3679320812225342
As a research head, I want to access to the persistent identifiers of datasets provided in the DMP, so that I can check that the DMP has been implemented|access|read|0.24499478936195374
As a funder, I want to be able to read the costs for data management from the DMP, so that I can check whether our policies work as intended|read|read|0.2923673987388611
As a researcher, I want the DMP to prepopulate information that I have already entered in other institutional systems, so that I do not have to re-enter information ensuring the DMP contains accurate and standardized information|want|read|0.34304413199424744
As a stakeholder, I want to know when the data management plan was created or updated, so that I know how up-to-date the plan is or whether it needs to be updated|know|update|0.3584240674972534
As a stakeholder, I want to know who is responsible for the DMP, so that I can ask them about further details|know|update|0.24445544183254242
As a stakeholder, I want to have references to the project proposal, so that I can look up further general information|have|read|0.20063063502311707
As a metadata manager, I want to have a short description of project, so that I can be informed about the metadata description|have|read|0.3881762623786926
As a rector, I want to know how many data will be stored, so that I can plan long term resources|know|read|0.2888777256011963
As a data manager, I want to know the time plan for collecting data, so that I can plan the data management|know|read|0.3643835186958313
As a data librarian, I want to import administrative information regarding a project into DMP, so that I can prepopulate the DMP|import|read|0.30160972476005554
As a manager, I want to know about all resources for the data, so that I can estimate the true cost of the project|know|read|0.22494950890541077
As a manager, I want to know about all services used for the data, so that I can estimate the true cost of the project|know|read|0.22413799166679382
As an archivemanager, I want to reuse the information regarding file format, so that I can apply automated checks for the file validation|reuse|read|0.17952227592468262
As a researcher, I want to know how many resources are needed during the project, so that I can calculate costs|know|read|0.2675088346004486
As a researcher, I want to extract the description of the data collected, so that I can reuse it for the writing of a data paper|extract|read|0.28967899084091187
As a researcher, I want to record research publications in the institutional repository or CRIS with DMP records, so that I can generate reports of research output resulting from a project|record|read|0.17895416915416718
As a researcher, I want to link research publications in the institutional repository or CRIS with DMP records, so that I can generate reports of research output resulting from a project|link|read|0.2058684527873993
As a researcher, I want to store agreements relating to third party data used in a project, so that the data can be cited, attributed and used correctly|store|read|0.33480367064476013
As an ethics manager, I want to be informed about the data, so that I can check for sensitivity of data|be informed|read|0.2498076856136322
As a repository operator, I want to know about the kind of data, so that I can evaluate the storage size and system|know|read|0.16881072521209717
As a researcher, I want to know about costs, so that I can plan my research|know|read|0.1879059076309204
As a repository manager, I need details on the type of data, so that I can check if the archiving can be arranged|need|read|0.34803006052970886
As an IT officer, I want to know how secure data is, so that I can ensure legal compliance|know|read|0.38729044795036316
As a funder, I want to know how secure data is, so that I can ensure legal compliance|know|update|0.3863219916820526
As a Research Centre Director, I want to receive regular summary reports of research data, so that I understand trends in data use among staff and postgraduate students|receive|read|0.21972349286079407
As a Postgraduate Convenor, I want to receive regular summary reports of research data, so that I understand trends in data use among staff and postgraduate students|receive|read|0.2184649556875229
As a research support officer, I want to ensure compliance to the funders’ rules, so that I can ensure all costs will be accepted|ensure|update|0.38008880615234375
As a funder, I want to be able to check all the repositories mentioned in a DMP, so that I can verify whether the project has followed our funding rules|check|read|0.21884052455425262
As a PI, I want to plan what kind of data I want to store, so that I can ensure it will be possible to store it|plan|read|0.23980578780174255
As a PI, I want to know how secure data is, so that I can ensure legal compliance|know|read|0.3789287805557251
As a Director of Research Integrity, I want to access reports containing details of research projects in which data are classified as sensitive or highly sensitive, so that I can confirm security protocols are applied to these data|access|update|0.3537146747112274
As an archive, I want to get information about the volume of data to preserve at an early stage, so that I can provide the adequate storage infrastructure|get|update|0.1679319143295288
As a researcher, I want to know how long it will take to archive, so that I can plan further steps|know|read|0.3578045964241028
As a PI, I want to know who owns the data, so that I know what I am allowed to do with it|know|read|0.22388340532779694
As a data manager, I want to have references to documentation of the data, so that the data can be re-used and managed|have|read|0.25126561522483826
As a data manager, I want to have the creation process, so that the data can be re-used and managed|have|read|0.3825567960739136
As an archivemanager, I want to make sure that detailed metadata are associated to data so that it will be understandable by future users|make sure|read|0.19991302490234375
As a data manager, I want to know which kind of data types will be produced or collected, so that I can ensure that the necessary technical resources and technical know-how is available|know|read|0.3767794668674469
As an IT staff member, I want to know which kind of data types will be produced or collected, so that I can ensure that the necessary technical resources and technical know-how is available|know|read|0.355198472738266
As an IT staff member, I want to know how the data is used, so that I can determine what kind of basic services and functionalities are required|know|read|0.2719375789165497
As a data manager, I want to know whether the collected data depends on other data sets from my own or other institutions, so that I can ensure that these dependencies are maintained|know|read|0.40210995078086853
As an IT staff member, I want to know which formats are used, so that I can determine what kind of technical services and functionalities are required|know|read|0.2934083342552185
As an IT staff member, I want to know with which software the data is produced or used, so that I can determine what kind of technical services and functionalities are required|know|read|0.2482428401708603
As an IT staff member, I want to know with which technology the data is produced or used, so that I can determine what kind of technical services and functionalities are required|know|read|0.3110060691833496
As a data manager, I want to know which information is necessary to re-use the data, so that it can be checked whether all necessary information is available for researchers interested in re-using the data|know|read|0.35775279998779297
As a data manager, I want to know which formats are used, so that I know what technology or background information might be necessary to use the data|know|read|0.3375033140182495
As a data manager, I want to know whether the data can be reproduced efficiently, so that I can determine whether and how the data has to be stored|know|read|0.27956652641296387
As a data manager, I want to know with which software the data is produced or used, so that I know what technology or background information might be necessary to (re-)use the data|know|read|0.27571067214012146
As a data manager, I want to know with which technology the data is produced or used, so that I know what technology or background information might be necessary to (re-)use the data|know|read|0.337726354598999
As a research evaluation manager, I want to ensure all metadata are quoted correctly with our affiliation, so that they are counted towards our citation counts|ensure|update|0.290621817111969
As an administrator, I want to check that all data has the appropriate security level, so that I can demonstrate compliance|check|read|0.11837911605834961
As a data manager, I want to know the security requirements of the data, so that I can check whether the data can be kept secure|know|read|0.32720839977264404
As a institutional data steward, I want to be able to extract the data sets that are submitted to external repositories, so that I can add them to an institutional data catalogue|extract|read|0.30238136649131775
As an institutional data manager, I want to know about the privacy and security requirements of the data, so that I can plan the right storage system and sharing permissions|know|update|0.28230470418930054
As a researcher, I want to see the sections on costing by other researchers in my department, so that I can see if we could share data manager posts|see|read|0.35560089349746704
As a researcher, I want to see the sections on roles submitted by other researchers in my department, so that I can see if we could share data manager posts|see|read|0.26854217052459717
As a researcher, I want to see the sections on responsibilities submitted by other researchers in my department, so that I can see if we could share data manager posts|see|read|0.2642070949077606
As a faculty data steward, I want to see the sections on costing, so that I can ensure sufficient expertise on data management to support the project|see|read|0.3737018406391144
As a faculty data steward, I want to see the sections on roles, so that I can ensure sufficient expertise on data management to support the project|see|read|0.26663628220558167
As a faculty data steward, I want to see the sections on responsibilities, so that I can ensure sufficient expertise on data management to support the project|see|read|0.2658197581768036
As a data manager, I want to clarify the necessary rights for re-using the data, so that it is legal to reuse the data|clarify|read|0.2787863314151764
As a researcher, I want to record my intention to share data I have collected under terms of a particular licence, so that other researchers who use the data understand the rights of use|record|read|0.22425182163715363
As a data manager, I want to plan the anonymization of data, so that we protect the privacy of the people participating in the research as good as possible and still ensure reusability of data|plan|read|0.29872655868530273
As a repository manager, I want to have metadata in additional languages, so that I can allow for multilingual data archive|have|read|0.2283135950565338
As a data manager, I want to know whether the DMP was approved, so that I can proceed with the required next steps|know|read|0.297227144241333
